{
  "schemaVersion": "1.0",
  "projectName": "FullStackPortfolio",
  "ticketKey": "FSP-1",
  "sessionPath": "knowledge-base/plans/active/FSP-1/",
  "ubiquitousLanguage": [
    {
      "term": "ClientOrganization",
      "definition": "The named client company or individual entity that commissions Projects. Root of the portal organizational hierarchy; all Projects, InvoiceRecords, and Stakeholder memberships belong to a ClientOrganization.",
      "context": "client_portal",
      "usageExamples": [
        "class ClientOrganization",
        "ClientOrganization.objects.get(slug=slug)",
        "class ClientOrganizationRepository(ABC)"
      ]
    },
    {
      "term": "UserProfile",
      "definition": "A portal participant - either a staff member or a client Stakeholder - identified by email address. Wraps Django's built-in User to carry portal-specific attributes such as is_client and organization.",
      "context": "client_portal",
      "usageExamples": [
        "class UserProfile",
        "UserProfile.user_id",
        "def get_profile(user_id: int) -> UserProfile"
      ]
    },
    {
      "term": "Stakeholder",
      "definition": "A UserProfile whose is_client attribute is True, representing a member of the client team who reviews Deliverables and authorizes Approvals. Semantically distinct from a staff UserProfile. Not a separate model - a role classification on UserProfile.",
      "context": "client_portal",
      "usageExamples": [
        "stakeholder: UserProfile",
        "def notify_stakeholders(project: Project) -> None",
        "if user_profile.is_client"
      ]
    },
    {
      "term": "Project",
      "definition": "A scoped, time-bounded body of work commissioned by a ClientOrganization. Progresses through states defined by ProjectStatus. Contains Milestones, Messages, and InvoiceRecords.",
      "context": "client_portal",
      "usageExamples": [
        "class Project",
        "project.status",
        "class ProjectRepository(ABC)",
        "Project.objects.filter(status=ProjectStatus.ACTIVE)"
      ]
    },
    {
      "term": "ProjectStatus",
      "definition": "Enumeration of valid Project lifecycle states. Values: DRAFT, ACTIVE, PENDING_APPROVAL, COMPLETE, ARCHIVED.",
      "context": "client_portal",
      "usageExamples": [
        "class ProjectStatus(str, Enum)",
        "project.status == ProjectStatus.COMPLETE",
        "ProjectStatus.PENDING_APPROVAL"
      ]
    },
    {
      "term": "Milestone",
      "definition": "A named checkpoint within a Project with a target completion date. Groups related Deliverables into reviewable phases. Progresses through states defined by MilestoneStatus.",
      "context": "client_portal",
      "usageExamples": [
        "class Milestone",
        "milestone.target_date",
        "milestone.project_id",
        "Milestone.objects.filter(project=project)"
      ]
    },
    {
      "term": "MilestoneStatus",
      "definition": "Enumeration of valid Milestone completion states. Values: PENDING (not yet started), IN_PROGRESS (work underway), COMPLETE (all Deliverables in the Milestone approved).",
      "context": "client_portal",
      "usageExamples": [
        "class MilestoneStatus(str, Enum)",
        "milestone.status == MilestoneStatus.COMPLETE",
        "MilestoneStatus.IN_PROGRESS"
      ]
    },
    {
      "term": "Deliverable",
      "definition": "A concrete work product produced within a Milestone, submitted for Stakeholder review and formal Approval. Versioned through DeliverableVersion records each time a revision is submitted.",
      "context": "client_portal",
      "usageExamples": [
        "class Deliverable",
        "deliverable.milestone_id",
        "class DeliverableService",
        "Deliverable.objects.filter(milestone=milestone)"
      ]
    },
    {
      "term": "DeliverableVersion",
      "definition": "An immutable, versioned snapshot of a Deliverable's content created each time a new revision is submitted for review. Preserves the full review history. version_number is a monotonically increasing integer per Deliverable.",
      "context": "client_portal",
      "usageExamples": [
        "class DeliverableVersion",
        "DeliverableVersion.version_number",
        "class DeliverableVersionRepository(ABC)",
        "DeliverableVersion.objects.filter(deliverable=deliverable)"
      ]
    },
    {
      "term": "Approval",
      "definition": "A formal, immutable decision record created when a Stakeholder accepts or rejects a specific DeliverableVersion. Carries ApprovalStatus and an optional reviewer comment.",
      "context": "client_portal",
      "usageExamples": [
        "class Approval",
        "Approval.status",
        "approval.reviewer_id",
        "class ApprovalStatus(str, Enum)"
      ]
    },
    {
      "term": "ApprovalStatus",
      "definition": "Enumeration of valid Approval decision states. Values: PENDING, APPROVED, REJECTED, REVISION_REQUESTED.",
      "context": "client_portal",
      "usageExamples": [
        "class ApprovalStatus(str, Enum)",
        "approval.status == ApprovalStatus.APPROVED",
        "ApprovalStatus.REVISION_REQUESTED"
      ]
    },
    {
      "term": "FileRecord",
      "definition": "Metadata describing a file asset attached to a Deliverable or Message. Stores filename, storage path, MIME type, and file size. Does not contain binary data; binary data resides in object storage.",
      "context": "client_portal",
      "usageExamples": [
        "class FileRecord",
        "FileRecord.storage_path",
        "FileRecord.mime_type",
        "class FileRecordModel"
      ]
    },
    {
      "term": "MessageThread",
      "definition": "A named, ordered channel within a Project that groups related Messages by topic or Milestone. Provides context for asynchronous communication between portal participants.",
      "context": "client_portal",
      "usageExamples": [
        "class MessageThread",
        "MessageThread.project_id",
        "MessageThread.subject",
        "class MessageThreadModel"
      ]
    },
    {
      "term": "Message",
      "definition": "A single communication from a portal participant addressed to a MessageThread within a Project. Contains the message body, sender reference, and creation timestamp. Messages are append-only; no editing or deletion.",
      "context": "client_portal",
      "usageExamples": [
        "class Message",
        "Message.thread_id",
        "Message.sender_id",
        "class MessageRepository(ABC)"
      ]
    },
    {
      "term": "InvoiceRecord",
      "definition": "A billing document issued to a ClientOrganization itemizing charges for Project work. Tracks payment lifecycle via InvoiceStatus. Carries due_date, amount, and line items.",
      "context": "client_portal",
      "usageExamples": [
        "class InvoiceRecord",
        "InvoiceRecord.due_date",
        "InvoiceRecord.amount",
        "class InvoiceStatus(str, Enum)"
      ]
    },
    {
      "term": "InvoiceStatus",
      "definition": "Enumeration of valid InvoiceRecord payment states. Values: DRAFT (not yet sent), SENT (delivered to client), PAID (payment confirmed), OVERDUE (past due date without payment), CANCELLED (voided).",
      "context": "client_portal",
      "usageExamples": [
        "class InvoiceStatus(str, Enum)",
        "invoice.status == InvoiceStatus.OVERDUE",
        "InvoiceStatus.PAID"
      ]
    },
    {
      "term": "ActivityEvent",
      "definition": "An immutable, append-only log entry capturing a significant domain action within the portal. Event type is expressed in past tense per DDD convention. Never updated or deleted after creation.",
      "context": "client_portal",
      "usageExamples": [
        "class ActivityEvent",
        "ActivityEvent.event_type",
        "class ActivityEventRepository(ABC)",
        "ActivityEvent.objects.filter(project=project).order_by('occurred_at')"
      ]
    },
    {
      "term": "Portal",
      "definition": "The bounded context itself - the secure, role-gated web application through which ClientOrganization Stakeholders collaborate with the service provider on Projects.",
      "context": "client_portal",
      "usageExamples": [
        "apps.client_portal",
        "from apps.client_portal.domain.model import Project"
      ]
    }
  ],
  "entities": [
    {
      "name": "ClientOrganization",
      "boundedContext": "client_portal",
      "identity": "UUID",
      "invariants": [
        "name must not be blank",
        "slug must be non-empty, URL-safe (alphanumeric and hyphens only), and unique across all ClientOrganization records",
        "A ClientOrganization may not be the target of an InvoiceRecord unless it has at least one Stakeholder (UserProfile with is_client=True)",
        "created_at is set once at construction and is immutable"
      ],
      "stateTransitions": [],
      "attributes": [
        { "name": "id", "type": "UUID", "description": "Unique identity, assigned at construction via uuid4()" },
        { "name": "name", "type": "str", "description": "Human-readable display name of the client company or individual" },
        { "name": "slug", "type": "str", "description": "URL-safe identifier used in portal routes; unique per portal instance" },
        { "name": "created_at", "type": "datetime", "description": "UTC timestamp set at construction; immutable thereafter" }
      ]
    },
    {
      "name": "UserProfile",
      "boundedContext": "client_portal",
      "identity": "UUID",
      "invariants": [
        "email must be a non-empty, syntactically valid email address",
        "user_id must uniquely reference a Django User; no two UserProfiles may share the same user_id",
        "If is_client is True, organization_id must not be null - a Stakeholder must belong to a ClientOrganization",
        "A staff UserProfile (is_client=False) must have organization_id set to null"
      ],
      "stateTransitions": [],